{
  "repo_fingerprint": "431f0c71eafeeb480584e518b9e430453f702411",
  "generated_by": "git ls-files taskdesk-legacy db with deterministic extension classification",
  "summary": {
    "total_files": 56,
    "scope_roots": [
      "taskdesk-legacy",
      "db"
    ],
    "languages": {
      "Markdown": 2,
      "SQLite": 1,
      "SQL": 3,
      "Shell": 2,
      "XML": 5,
      "Java": 31,
      "Properties": 3,
      "CSS": 1,
      "JSP": 8
    },
    "frameworks_detected": [
      {
        "name": "Maven WAR",
        "evidence": [
          "taskdesk-legacy/pom.xml"
        ],
        "confidence": 1.0
      },
      {
        "name": "Struts 1.x",
        "evidence": [
          "taskdesk-legacy/pom.xml",
          "taskdesk-legacy/src/main/webapp/WEB-INF/struts-config.xml",
          "taskdesk-legacy/src/main/webapp/WEB-INF/web.xml"
        ],
        "confidence": 1.0
      },
      {
        "name": "JSP/JSTL",
        "evidence": [
          "taskdesk-legacy/pom.xml",
          "taskdesk-legacy/src/main/webapp/jsp/login.jsp"
        ],
        "confidence": 0.95
      },
      {
        "name": "SQLite JDBC",
        "evidence": [
          "taskdesk-legacy/pom.xml",
          "taskdesk-legacy/src/main/resources/taskdesk.properties",
          "taskdesk-legacy/src/main/java/com/example/taskdesk/dao/JdbcConnectionManager.java"
        ],
        "confidence": 1.0
      }
    ],
    "excluded": [
      {
        "pattern": ".work/**",
        "reason": "semantic-loop generated artefacts are outside requested application/database scope"
      },
      {
        "pattern": ".cache/**",
        "reason": "parser cache and loop scripts are outside requested application/database scope"
      },
      {
        "pattern": ".agent-loop/**",
        "reason": "loop instructions/tools are not application source"
      },
      {
        "pattern": "target/**",
        "reason": "build output excluded if present"
      }
    ]
  },
  "files": [
    {
      "path": "db/runtime-data/README.md",
      "language": "Markdown",
      "role": "documentation",
      "artifact_types": [],
      "size_bytes": 303,
      "hash": "a3f1c3421c2a5ddb5edde468f162131e1aa646cb3d6c9c5898751c7cee2e93fb",
      "uncertainty": null
    },
    {
      "path": "db/runtime-data/taskdesk-demo.sqlite",
      "language": "SQLite",
      "role": "data",
      "artifact_types": [
        "sqlite-database"
      ],
      "size_bytes": 53248,
      "hash": "93d02f7d265f0a10a80ddc9b048476782501534cc2e01d8ef868594580521944",
      "uncertainty": null
    },
    {
      "path": "db/sql/001_schema_sqlite.sql",
      "language": "SQL",
      "role": "data",
      "artifact_types": [
        "sql-script"
      ],
      "size_bytes": 2031,
      "hash": "ec3e1fc49bdfa997a8d6a1a885bc9f693538f2f96790b5187a9b87e6714bdb69",
      "uncertainty": null
    },
    {
      "path": "db/sql/002_seed_data.sql",
      "language": "SQL",
      "role": "data",
      "artifact_types": [
        "sql-script"
      ],
      "size_bytes": 2447,
      "hash": "866ae4a0479cf99b6313689bedac7474c470eaab0325fb0d4a76e9ede0f97934",
      "uncertainty": null
    },
    {
      "path": "db/sql/003_reset_database.sql",
      "language": "SQL",
      "role": "data",
      "artifact_types": [
        "sql-script"
      ],
      "size_bytes": 4480,
      "hash": "306d8779206e585f6a3d02ff87d5db2f9fe72fe422130a3f5671b1d9cba9e5ac",
      "uncertainty": null
    },
    {
      "path": "taskdesk-legacy/README.md",
      "language": "Markdown",
      "role": "documentation",
      "artifact_types": [],
      "size_bytes": 5427,
      "hash": "d75e225b96714f53ea5de7fef7b5c8a509d3c3571ecf5944b2e13a9469e99baf",
      "uncertainty": null
    },
    {
      "path": "taskdesk-legacy/paths.sh",
      "language": "Shell",
      "role": "build",
      "artifact_types": [],
      "size_bytes": 1549,
      "hash": "d01f02fcafc47e4016ceb6471abb5813ba49177eacc268f8835c0d999b64322b",
      "uncertainty": null
    },
    {
      "path": "taskdesk-legacy/pom.xml",
      "language": "XML",
      "role": "build",
      "artifact_types": [
        "maven-pom",
        "xml-file"
      ],
      "size_bytes": 2331,
      "hash": "5e137682dc3d438c35f3cf7d0e03f63e032987930214e44ba51c753a1b09724b",
      "uncertainty": null
    },
    {
      "path": "taskdesk-legacy/redeploy.sh",
      "language": "Shell",
      "role": "build",
      "artifact_types": [],
      "size_bytes": 538,
      "hash": "2d63413d409178ef690409fb643fe3f30854c51100e728ff00bb3a5b851bb424",
      "uncertainty": null
    },
    {
      "path": "taskdesk-legacy/src/main/java/com/example/taskdesk/action/BaseTaskDeskAction.java",
      "language": "Java",
      "role": "source",
      "artifact_types": [
        "java-source"
      ],
      "size_bytes": 1129,
      "hash": "3257ddfebbf6f9073905462b74d30ec35242f4d5a87fe3630d1d7531a403a076",
      "uncertainty": null
    },
    {
      "path": "taskdesk-legacy/src/main/java/com/example/taskdesk/action/LoginAction.java",
      "language": "Java",
      "role": "source",
      "artifact_types": [
        "java-source"
      ],
      "size_bytes": 1676,
      "hash": "01471dfc8b3f2c2b9ba295813dd0646eb1ad90455c16d09eb13d033d0db77f3d",
      "uncertainty": null
    },
    {
      "path": "taskdesk-legacy/src/main/java/com/example/taskdesk/action/LogoutAction.java",
      "language": "Java",
      "role": "source",
      "artifact_types": [
        "java-source"
      ],
      "size_bytes": 718,
      "hash": "56d2fac7f42b211db55a55200701ba40be480ee365d5530285f1987f67e4215e",
      "uncertainty": null
    },
    {
      "path": "taskdesk-legacy/src/main/java/com/example/taskdesk/action/TaskAssignAction.java",
      "language": "Java",
      "role": "source",
      "artifact_types": [
        "java-source"
      ],
      "size_bytes": 2247,
      "hash": "77fb63aa1d4aee2c8eec72ec7908bbb3f497deeec91ba47de07a4ef352b19c87",
      "uncertainty": null
    },
    {
      "path": "taskdesk-legacy/src/main/java/com/example/taskdesk/action/TaskCompleteAction.java",
      "language": "Java",
      "role": "source",
      "artifact_types": [
        "java-source"
      ],
      "size_bytes": 1728,
      "hash": "d6b0a17bd408b80d412b460db0e73a9215e7427bec69bb5bb574d52329d3ef96",
      "uncertainty": null
    },
    {
      "path": "taskdesk-legacy/src/main/java/com/example/taskdesk/action/TaskDetailAction.java",
      "language": "Java",
      "role": "source",
      "artifact_types": [
        "java-source"
      ],
      "size_bytes": 1791,
      "hash": "a26b1bd3eed7d6ac984f24fdf6c99d17f9372634f20fc966cdb7d456d76bbc6d",
      "uncertainty": null
    },
    {
      "path": "taskdesk-legacy/src/main/java/com/example/taskdesk/action/TaskEditAction.java",
      "language": "Java",
      "role": "source",
      "artifact_types": [
        "java-source"
      ],
      "size_bytes": 2313,
      "hash": "ee5ed4f3b4ddc95c1d38f1882824869a1407affeffe375496060fbc8454c245a",
      "uncertainty": null
    },
    {
      "path": "taskdesk-legacy/src/main/java/com/example/taskdesk/action/TaskListAction.java",
      "language": "Java",
      "role": "source",
      "artifact_types": [
        "java-source"
      ],
      "size_bytes": 2500,
      "hash": "504eb9c80b7e72f6c4e227a0b13db8abd3520ca2971432bf02aa3d460052bdb5",
      "uncertainty": null
    },
    {
      "path": "taskdesk-legacy/src/main/java/com/example/taskdesk/action/TaskReopenAction.java",
      "language": "Java",
      "role": "source",
      "artifact_types": [
        "java-source"
      ],
      "size_bytes": 1486,
      "hash": "fc49d484903ff9a12d4471e3123f27ecf4da4393379bc993cecb243e965fd241",
      "uncertainty": null
    },
    {
      "path": "taskdesk-legacy/src/main/java/com/example/taskdesk/action/TaskReportAction.java",
      "language": "Java",
      "role": "source",
      "artifact_types": [
        "java-source"
      ],
      "size_bytes": 2557,
      "hash": "8cc895274344fbeedd1314e55cc862aed0869ed289e3292e85dfdfe96db9e957",
      "uncertainty": null
    },
    {
      "path": "taskdesk-legacy/src/main/java/com/example/taskdesk/action/TaskSaveAction.java",
      "language": "Java",
      "role": "source",
      "artifact_types": [
        "java-source"
      ],
      "size_bytes": 5379,
      "hash": "498a79e02f59d309848dc57a1acb3250525d6ee5e0fbc6c6eac4601961b397d2",
      "uncertainty": null
    },
    {
      "path": "taskdesk-legacy/src/main/java/com/example/taskdesk/dao/AuditDAO.java",
      "language": "Java",
      "role": "source",
      "artifact_types": [
        "java-source"
      ],
      "size_bytes": 5658,
      "hash": "927c3b425d7c1bcd8c47f627c522f8e9ae76a0b500cbdc4b007637d8298f7d3a",
      "uncertainty": null
    },
    {
      "path": "taskdesk-legacy/src/main/java/com/example/taskdesk/dao/JdbcConnectionManager.java",
      "language": "Java",
      "role": "source",
      "artifact_types": [
        "java-source"
      ],
      "size_bytes": 2315,
      "hash": "f7a91e7e5040d95465f4a86373178a4d70ff575740760e5bc089553466f2ddb5",
      "uncertainty": null
    },
    {
      "path": "taskdesk-legacy/src/main/java/com/example/taskdesk/dao/TaskDAO.java",
      "language": "Java",
      "role": "source",
      "artifact_types": [
        "java-source"
      ],
      "size_bytes": 13771,
      "hash": "f304293811439569b63242e055ec738e3a982dc8f6d3b8d6ebdb4ee473ccc67c",
      "uncertainty": null
    },
    {
      "path": "taskdesk-legacy/src/main/java/com/example/taskdesk/dao/UserDAO.java",
      "language": "Java",
      "role": "source",
      "artifact_types": [
        "java-source"
      ],
      "size_bytes": 3887,
      "hash": "6404032df308f9cda8b75ac55d1b05385a07c89f9bee2566b6d4684e5dcfddc3",
      "uncertainty": null
    },
    {
      "path": "taskdesk-legacy/src/main/java/com/example/taskdesk/form/LoginForm.java",
      "language": "Java",
      "role": "source",
      "artifact_types": [
        "java-source"